{
  "run_id": "a0a17f4b",
  "eval_timestamp": "2026-03-01T22:20:51.263203",
  "dataset": {
    "split": "val",
    "symbols": 3,
    "samples": 11313
  },
  "pinball_loss": {
    "overall": 0.1832898257879797,
    "by_horizon": {
      "h1": 0.15261276675706614,
      "h5": 0.21261134381531926,
      "h20": 0.18536680903291214,
      "h60": 0.18256838354662114
    }
  },
  "quantile_coverage": {
    "q10": 0.0,
    "q30": 0.0,
    "q50": 1.0,
    "q70": 1.0,
    "q90": 1.0
  },
  "quantile_crossing": {
    "rate": 0.0,
    "count": 0
  },
  "ic_metrics": {
    "ic": -0.01270302655984214,
    "rank_ic": -0.00757600845770861,
    "ic_by_horizon": {
      "h1": -0.01270302655984214,
      "h5": -0.00806237509105312,
      "h20": -0.020774397159992214,
      "h60": 0.007574738605786275
    }
  },
  "by_symbol": [
    {
      "symbol": "DCE.JM",
      "samples": 726,
      "pinball_loss": 0.18502792205069915,
      "ic": 0.003994659051288679
    },
    {
      "symbol": "SHFE.AG",
      "samples": 9383,
      "pinball_loss": 0.18344262686290586,
      "ic": -0.010036149005974703
    },
    {
      "symbol": "CZCE.MA",
      "samples": 1204,
      "pinball_loss": 0.1810509633521269,
      "ic": 0.05569397260058695
    }
  ]
}